[
  {
    "id": "peru-ma/select-board-member",
    "organization_id": "ocd-organization/a16ae12a-f26f-5666-9dc2-ca595ba6cd19",
    "title": "Select Board Member",
    "seats": 3,
    "sources": [
      {
        "url": "https://files.heygov.com/townofperuma.com/Annual%20Town%20Report%202024-2025.pdf",
        "retrieved": "2026-08-26"
      }
    ]
  },
  {
    "id": "peru-ma/town-clerk",
    "organization_id": "ocd-organization/cb415a53-61ff-5108-9023-6a8e034dc86a",
    "title": "Town Clerk",
    "seats": 1,
    "sources": [
      {
        "url": "https://files.heygov.com/townofperuma.com/Annual%20Town%20Report%202024-2025.pdf",
        "retrieved": "2026-08-26"
      }
    ]
  },
  {
    "id": "peru-ma/finance-committee-member",
    "organization_id": "ocd-organization/5dbf9a34-6cad-5be3-96e3-c82e95a127e3",
    "title": "Finance Committee Member",
    "seats": 5,
    "sources": [
      {
        "url": "https://files.heygov.com/townofperuma.com/Annual%20Town%20Report%202024-2025.pdf",
        "retrieved": "2026-08-26"
      }
    ]
  },
  {
    "id": "peru-ma/planning-board-member",
    "organization_id": "ocd-organization/bfe3c545-4956-5310-8430-062aef788284",
    "title": "Planning Board Member",
    "seats": 5,
    "sources": [
      {
        "url": "https://files.heygov.com/townofperuma.com/Annual%20Town%20Report%202024-2025.pdf",
        "retrieved": "2026-08-26"
      }
    ]
  },
  {
    "id": "peru-ma/board-of-health-member",
    "organization_id": "ocd-organization/3141bba4-844a-5408-8a3c-30a144ca42ba",
    "title": "Board of Health Member",
    "seats": 3,
    "sources": [
      {
        "url": "https://files.heygov.com/townofperuma.com/Annual%20Town%20Report%202024-2025.pdf",
        "retrieved": "2026-08-26"
      }
    ]
  },
  {
    "id": "peru-ma/constable",
    "organization_id": "ocd-organization/467ed703-fe1f-56ef-ba4c-c0d6b4743013",
    "title": "Constable",
    "seats": 2,
    "sources": [
      {
        "url": "https://files.heygov.com/townofperuma.com/Annual%20Town%20Report%202024-2025.pdf",
        "retrieved": "2026-08-26"
      }
    ]
  },
  {
    "id": "peru-ma/moderator",
    "organization_id": "ocd-organization/a9fad140-3f96-5160-9ff0-5209dd04ddc8",
    "title": "Moderator",
    "seats": 1,
    "sources": [
      {
        "url": "https://files.heygov.com/townofperuma.com/Annual%20Town%20Report%202024-2025.pdf",
        "retrieved": "2026-08-26"
      }
    ]
  },
  {
    "id": "peru-ma/central-berkshire-regional-school-committee-member",
    "organization_id": "ocd-organization/4087d84a-932b-5836-9f48-b3fea19b2135",
    "title": "Central Berkshire Regional School Committee Member",
    "seats": 1,
    "sources": [
      {
        "url": "https://files.heygov.com/townofperuma.com/Annual%20Town%20Report%202024-2025.pdf",
        "retrieved": "2026-08-26"
      }
    ]
  }
]
